{
  "id": "inferno_06",
  "canticle": "inferno",
  "number": 6,
  "title": "Gluttony",
  "subtitle_it": "piova etterna",
  "role": "combat",
  "circle": 3,
  "geo": {
    "bounds": {
      "width": 160,
      "height": 120
    },
    "spawn": {
      "x": 18,
      "y": 52
    },
    "exits": [
      {
        "to_canto": "inferno_05",
        "x": 10,
        "y": 52,
        "label": "Return to Lust"
      },
      {
        "to_canto": "inferno_01",
        "x": 14,
        "y": 44,
        "label": "Return to Dark Wood"
      },
      {
        "to_canto": "inferno_07",
        "x": 150,
        "y": 52,
        "label": "Toward Avarice →",
        "require_clear": "inferno_06",
        "hint": "peso e contrapeso — Hold E when the Maw is clear"
      }
    ],
    "pois": [
      {
        "id": "mire_bell",
        "kind": "bell",
        "x": 86,
        "y": 58,
        "label": "Mire Bell",
        "hint": "Stills nearby filth — then press the Maw"
      },
      {
        "id": "filth_cache",
        "kind": "cache",
        "x": 54,
        "y": 68,
        "label": "Filth Cache",
        "hint": "One champion drop per visit — E to claim"
      },
      {
        "id": "mire_shrine",
        "kind": "shrine",
        "x": 28,
        "y": 56,
        "label": "Mire Shrine",
        "hint": "Restores life and breath — E to kneel"
      }
    ]
  },
  "packs": [
    {
      "id": "glut_mire_heart",
      "name": "Mire Heart",
      "archetype": "mire_heart",
      "count": 1,
      "elite": true,
      "champion": true,
      "drop_table": "inferno_pack_common",
      "anchor": {
        "x": 74,
        "y": 64
      }
    },
    {
      "id": "glut_wisps",
      "name": "Filth Wisps",
      "archetype": "mud_wisp",
      "count": 4,
      "elite": false,
      "champion": false,
      "drop_table": "inferno_pack_common",
      "anchor": {
        "x": 38,
        "y": 72
      }
    },
    {
      "id": "glut_road_wardens",
      "name": "Road Sludge",
      "archetype": "mire_shade",
      "count": 2,
      "elite": false,
      "champion": false,
      "drop_table": "inferno_pack_common",
      "anchor": {
        "x": 28,
        "y": 50
      }
    },
    {
      "id": "glut_mire_a",
      "name": "Bog Ward",
      "archetype": "mire_shade",
      "count": 3,
      "elite": false,
      "champion": false,
      "drop_table": "inferno_pack_common",
      "anchor": {
        "x": 52,
        "y": 36
      }
    },
    {
      "id": "glut_mire_b",
      "name": "South Slough",
      "archetype": "mire_shade",
      "count": 3,
      "elite": false,
      "champion": false,
      "drop_table": "inferno_pack_common",
      "anchor": {
        "x": 66,
        "y": 80
      }
    },
    {
      "id": "glut_champion_pair",
      "name": "Mire Champions",
      "archetype": "mire_champion",
      "count": 2,
      "elite": true,
      "champion": true,
      "drop_table": "inferno_pack_common",
      "anchor": {
        "x": 96,
        "y": 42
      }
    },
    {
      "id": "glut_strays",
      "name": "Stray Greed",
      "archetype": "mire_shade",
      "count": 2,
      "elite": false,
      "champion": false,
      "drop_table": "inferno_pack_common",
      "anchor": {
        "x": 88,
        "y": 74
      }
    },
    {
      "id": "glut_chorus",
      "name": "Glut Chorus",
      "archetype": "mire_shade",
      "count": 3,
      "elite": false,
      "champion": false,
      "drop_table": "inferno_pack_common",
      "anchor": {
        "x": 110,
        "y": 68
      }
    },
    {
      "id": "glut_approach_flank",
      "name": "Maw Approach",
      "archetype": "mire_shade",
      "count": 2,
      "elite": false,
      "champion": false,
      "drop_table": "inferno_pack_common",
      "anchor": {
        "x": 122,
        "y": 42
      }
    },
    {
      "id": "glut_gate_warden",
      "name": "Mire Warden",
      "archetype": "mire_warden",
      "count": 1,
      "elite": true,
      "champion": true,
      "drop_table": "inferno_pack_common",
      "anchor": {
        "x": 126,
        "y": 56
      }
    },
    {
      "id": "glut_cerbero",
      "name": "Cerbero",
      "archetype": "mire_champion",
      "count": 1,
      "elite": true,
      "champion": true,
      "drop_table": "inferno_pack_common",
      "anchor": {
        "x": 130,
        "y": 50
      },
      "notes": "Mid-lane elite telegraph before Triple Maw"
    }
  ],
  "bosses": [
    {
      "id": "triple_maw",
      "name": "Triple Maw",
      "drop_table": "inferno_pack_common",
      "anchor": {
        "x": 138,
        "y": 48
      },
      "first_clear_emit": true
    }
  ],
  "first_clear": {
    "enabled": true,
    "event": "FirstClear",
    "requires": "triple_maw",
    "notes": "Triple Maw broken — Avarice (peso e contrapeso) opens past the Maw; bank loot at Dark Wood stash"
  },
  "daily_quests": [
    {
      "id": "glut_daily_mire",
      "objective": "Ring the Mire Bell to still a pack, then break the Triple Maw (or return from Gluttony once)",
      "emit_event": "DailyQuest",
      "notes": "Flavor + alternate claim path via Mire Bell after Guide; shares UTC daily cap with Dark Wood writ"
    }
  ],
  "style_kit": {
    "palette": "inferno_red_black",
    "kit_id": "circle_03_gluttony",
    "notes": "Circle kit 3 of 12; mud-rain filth; Doré line weight"
  },
  "loot_density": "raw_d2",
  "legal": {
    "text_source": "italian_original",
    "notes": "Names and short Italian tags only; original encounter design; no assets from other Dante games"
  }
}
